eid,doi,title,authors,year,journal,citations,scopus_link,search_desc,query,relevance_score,confirmed_compendium,search_idx,search_eid,search_doi,search_title,search_authors,search_year,match_status,match_confidence,match_type,reference_idx,reference_title,reference_doi,match_details
2-s2.0-85200951568,10.1007/s00198-024-07220-3,Association of proton-density fat fraction with osteoporosis: a systematic review and meta-analysis,Yuan K.,2024,Osteoporosis International,2,,Broad: AHRQ mentions,TITLE-ABS-KEY(AHRQ),6.0,False,224,2-s2.0-85200951568,10.1007/s00198-024-07220-3,Association of proton-density fat fraction with osteoporosis: a systematic review and meta-analysis,Yuan K.,2024,no_match,0.0,,,,,
2-s2.0-85202928917,10.1186/s13561-024-00525-3,Kidney transplant cases in US: study of determinants of variance in hospital charges and inpatient care,Akhigbe A.,2024,Health Economics Review,1,,Broad: AHRQ mentions,TITLE-ABS-KEY(AHRQ),6.0,False,225,2-s2.0-85202928917,10.1186/s13561-024-00525-3,Kidney transplant cases in US: study of determinants of variance in hospital charges and inpatient care,Akhigbe A.,2024,no_match,0.0,,,,,
2-s2.0-85212853699,10.1017/cts.2024.681,"Meaningfulness, feasibility, and usability of quality-of-care measures for maternal and infant health: A structured mixed-methods review",Theis R.P.,2024,Journal of Clinical and Translational Science,0,,Broad: AHRQ mentions,TITLE-ABS-KEY(AHRQ),6.0,False,226,2-s2.0-85212853699,10.1017/cts.2024.681,"Meaningfulness, feasibility, and usability of quality-of-care measures for maternal and infant health: A structured mixed-methods review",Theis R.P.,2024,no_match,0.0,,,,,
2-s2.0-105003106616,10.3389/fendo.2025.1567787,Association between waist-to-height ratio and insulin resistance in patients with polycystic ovary syndrome: a meta-analysis,Lan Y.,2025,Frontiers in Endocrinology,1,,Broad: AHRQ mentions,TITLE-ABS-KEY(AHRQ),6.0,False,227,2-s2.0-105003106616,10.3389/fendo.2025.1567787,Association between waist-to-height ratio and insulin resistance in patients with polycystic ovary syndrome: a meta-analysis,Lan Y.,2025,no_match,0.0,,,,,
2-s2.0-85215873968,10.1097/PHH.0000000000001983,"Examining the Relationship between Local Governmental Expenditures on the Social Determinants of Health and County-Level Overdose Deaths, 2017-2020",Lindenfeld Z.,2025,Journal of Public Health Management and Practice,1,,Broad: AHRQ mentions,TITLE-ABS-KEY(AHRQ),6.0,False,228,2-s2.0-85215873968,10.1097/PHH.0000000000001983,"Examining the Relationship between Local Governmental Expenditures on the Social Determinants of Health and County-Level Overdose Deaths, 2017-2020",Lindenfeld Z.,2025,no_match,0.0,,,,,
2-s2.0-85214286705,10.1016/j.ijnss.2024.12.004,Correlated factors of posttraumatic growth in patients with colorectal cancer: A systematic review and meta-analysis,Wei D.,2025,International Journal of Nursing Sciences,0,,Broad: AHRQ mentions,TITLE-ABS-KEY(AHRQ),6.0,False,229,2-s2.0-85214286705,10.1016/j.ijnss.2024.12.004,Correlated factors of posttraumatic growth in patients with colorectal cancer: A systematic review and meta-analysis,Wei D.,2025,no_match,0.0,,,,,
2-s2.0-105002023123,10.1177/21925682231190616,Revisiting Anticoagulation in Spine Surgery: Balancing Venous Thromboembolic Events and Epidural Hematoma,Massaro A.M.,2025,Global Spine Journal,2,,Broad: AHRQ mentions,TITLE-ABS-KEY(AHRQ),6.0,False,230,2-s2.0-105002023123,10.1177/21925682231190616,Revisiting Anticoagulation in Spine Surgery: Balancing Venous Thromboembolic Events and Epidural Hematoma,Massaro A.M.,2025,no_match,0.0,,,,,
2-s2.0-105001430472,10.1016/j.nepr.2025.104345,The role of artificial intelligence in shaping nursing education: A comprehensive systematic review,Ma J.,2025,Nurse Education in Practice,2,,Broad: AHRQ mentions,TITLE-ABS-KEY(AHRQ),6.0,False,231,2-s2.0-105001430472,10.1016/j.nepr.2025.104345,The role of artificial intelligence in shaping nursing education: A comprehensive systematic review,Ma J.,2025,no_match,0.0,,,,,
2-s2.0-85216528111,10.1016/j.rmed.2025.107969,Global prevalence of fatigue in patients with chronic obstructive pulmonary disease: A systematic review and meta-analysis,Shi W.,2025,Respiratory Medicine,1,,Broad: AHRQ mentions,TITLE-ABS-KEY(AHRQ),6.0,False,232,2-s2.0-85216528111,10.1016/j.rmed.2025.107969,Global prevalence of fatigue in patients with chronic obstructive pulmonary disease: A systematic review and meta-analysis,Shi W.,2025,no_match,0.0,,,,,
2-s2.0-85217010723,10.1016/j.yebeh.2025.110301,"Prevalence of anxiety, depression, and posttraumatic stress disorder in caregivers of children with epilepsy: A meta-analysis",Li Y.,2025,Epilepsy and Behavior,0,,Broad: AHRQ mentions,TITLE-ABS-KEY(AHRQ),6.0,False,233,2-s2.0-85217010723,10.1016/j.yebeh.2025.110301,"Prevalence of anxiety, depression, and posttraumatic stress disorder in caregivers of children with epilepsy: A meta-analysis",Li Y.,2025,no_match,0.0,,,,,
2-s2.0-105003406236,10.1186/s12913-025-12668-y,Assessment of a patient safety culture: a nationwide cross-sectional study comparing public and private hospitals in Kuwait,Alsaleh F.M.,2025,BMC Health Services Research,0,,Broad: AHRQ mentions,TITLE-ABS-KEY(AHRQ),6.0,False,234,2-s2.0-105003406236,10.1186/s12913-025-12668-y,Assessment of a patient safety culture: a nationwide cross-sectional study comparing public and private hospitals in Kuwait,Alsaleh F.M.,2025,no_match,0.0,,,,,
2-s2.0-86000346354,10.1186/s12909-025-06906-4,The application of an escape room teaching method on the training for ICU new nurses: a quasi-experimental study,Hu Q.,2025,BMC Medical Education,0,,Broad: AHRQ mentions,TITLE-ABS-KEY(AHRQ),6.0,False,235,2-s2.0-86000346354,10.1186/s12909-025-06906-4,The application of an escape room teaching method on the training for ICU new nurses: a quasi-experimental study,Hu Q.,2025,no_match,0.0,,,,,
2-s2.0-105003140429,10.1186/s12912-025-03063-3,Factors influencing self-management in patients with epilepsy: a systematic review and meta-analysis,Tian W.,2025,BMC Nursing,0,,Broad: AHRQ mentions,TITLE-ABS-KEY(AHRQ),6.0,False,236,2-s2.0-105003140429,10.1186/s12912-025-03063-3,Factors influencing self-management in patients with epilepsy: a systematic review and meta-analysis,Tian W.,2025,no_match,0.0,,,,,
2-s2.0-105000653967,10.1186/s12884-025-07459-6,Domestic violence in pregnancy: a systematic review of clinical guidelines,Babazadeh R.,2025,BMC Pregnancy and Childbirth,0,,Broad: AHRQ mentions,TITLE-ABS-KEY(AHRQ),6.0,False,237,2-s2.0-105000653967,10.1186/s12884-025-07459-6,Domestic violence in pregnancy: a systematic review of clinical guidelines,Babazadeh R.,2025,no_match,0.0,,,,,
2-s2.0-85218817573,10.1186/s12877-025-05719-w,Association between pain and behavioral and psychological symptoms of dementia (BPSD) in older adults with dementia: a systematic review and meta-analysis,Shi T.,2025,BMC Geriatrics,0,,Broad: AHRQ mentions,TITLE-ABS-KEY(AHRQ),6.0,False,238,2-s2.0-85218817573,10.1186/s12877-025-05719-w,Association between pain and behavioral and psychological symptoms of dementia (BPSD) in older adults with dementia: a systematic review and meta-analysis,Shi T.,2025,no_match,0.0,,,,,
2-s2.0-85218496564,10.1186/s12888-025-06603-y,A meta-analysis on the incidence rate of depression in Chinese menopausal women,Li X.L.,2025,BMC Psychiatry,1,,Broad: AHRQ mentions,TITLE-ABS-KEY(AHRQ),6.0,False,239,2-s2.0-85218496564,10.1186/s12888-025-06603-y,A meta-analysis on the incidence rate of depression in Chinese menopausal women,Li X.L.,2025,no_match,0.0,,,,,
2-s2.0-85180612644,10.1016/j.ypmed.2023.107828,Association of initial opioid prescription duration and an opioid refill by pain diagnosis: Evidence from outpatient settings in ten US health systems,Nguyen A.P.,2024,Preventive Medicine,0,,Institution: Mathematica,"AFFIL(Mathematica) AND TITLE-ABS-KEY(""health system*"")",6.0,False,240,2-s2.0-85180612644,10.1016/j.ypmed.2023.107828,Association of initial opioid prescription duration and an opioid refill by pain diagnosis: Evidence from outpatient settings in ten US health systems,Nguyen A.P.,2024,no_match,0.0,,,,,
2-s2.0-85175852253,10.1007/s11606-023-08459-y,Prescription Opioid Dose Reductions and Potential Adverse Events: a Multi-site Observational Cohort Study in Diverse US Health Systems,Metz V.E.,2024,Journal of General Internal Medicine,5,,Institution: Mathematica,"AFFIL(Mathematica) AND TITLE-ABS-KEY(""health system*"")",6.0,False,242,2-s2.0-85175852253,10.1007/s11606-023-08459-y,Prescription Opioid Dose Reductions and Potential Adverse Events: a Multi-site Observational Cohort Study in Diverse US Health Systems,Metz V.E.,2024,no_match,0.0,,,,,
2-s2.0-85187478602,10.1186/s43058-024-00561-4,Learning from the implementation of a surgical opioid reduction initiative in an integrated health system: a qualitative study among providers and patients,Schäfer W.L.A.,2024,Implementation Science Communications,1,,Institution: Mathematica,"AFFIL(Mathematica) AND TITLE-ABS-KEY(""health system*"")",6.0,False,243,2-s2.0-85187478602,10.1186/s43058-024-00561-4,Learning from the implementation of a surgical opioid reduction initiative in an integrated health system: a qualitative study among providers and patients,Schäfer W.L.A.,2024,no_match,0.0,,,,,
2-s2.0-85214820947,10.1016/j.joclim.2024.100359,ClimaWATCH: A new interactive tool for community heat-health vulnerability assessments,Keshaviah A.,2025,Journal of Climate Change and Health,0,,Institution: Mathematica,"AFFIL(Mathematica) AND TITLE-ABS-KEY(""health system*"")",6.0,False,244,2-s2.0-85214820947,10.1016/j.joclim.2024.100359,ClimaWATCH: A new interactive tool for community heat-health vulnerability assessments,Keshaviah A.,2025,no_match,0.0,,,,,
2-s2.0-105002455986,10.1513/AnnalsATS.202408-806OC,An Explanatory Mixed-Methods Study of Intensive Care Unit Net Benefit Triage and Trajectory for Sepsis and Acute Respiratory Failure,Anesi G.L.,2025,Annals of the American Thoracic Society,0,,Institution: Mathematica,"AFFIL(Mathematica) AND TITLE-ABS-KEY(""health system*"")",6.0,False,245,2-s2.0-105002455986,10.1513/AnnalsATS.202408-806OC,An Explanatory Mixed-Methods Study of Intensive Care Unit Net Benefit Triage and Trajectory for Sepsis and Acute Respiratory Failure,Anesi G.L.,2025,no_match,0.0,,,,,
2-s2.0-105003738949,10.1001/jamahealthforum.2025.0445,Changes in Primary Care Practice Setting and Practice Type for Medicare Beneficiaries,Bond A.M.,2025,JAMA Health Forum,0,,Institution: Mathematica,"AFFIL(Mathematica) AND TITLE-ABS-KEY(""health system*"")",6.0,False,246,2-s2.0-105003738949,10.1001/jamahealthforum.2025.0445,Changes in Primary Care Practice Setting and Practice Type for Medicare Beneficiaries,Bond A.M.,2025,no_match,0.0,,,,,
2-s2.0-86000160954,10.1001/jamainternmed.2024.8354,Telemedicine Adoption and Low-Value Care Use and Spending Among Fee-for-Service Medicare Beneficiaries,Ganguli I.,2025,JAMA Internal Medicine,0,,Author: Ganguli,"AUTHOR-NAME(""Ganguli I*"") AND TITLE-ABS-KEY(""health system*"")",6.0,False,247,2-s2.0-86000160954,10.1001/jamainternmed.2024.8354,Telemedicine Adoption and Low-Value Care Use and Spending Among Fee-for-Service Medicare Beneficiaries,Ganguli I.,2025,no_match,0.0,,,,,
2-s2.0-85218166199,10.1001/jamainternmed.2024.8190,Denominator and Composite Calculation Errors in Study of Health System Low-Value Services,Ganguli I.,2025,JAMA Internal Medicine,0,,Author: Ganguli,"AUTHOR-NAME(""Ganguli I*"") AND TITLE-ABS-KEY(""health system*"")",6.0,False,248,2-s2.0-85218166199,10.1001/jamainternmed.2024.8190,Denominator and Composite Calculation Errors in Study of Health System Low-Value Services,Ganguli I.,2025,no_match,0.0,,,,,
2-s2.0-105002224863,10.1016/j.numecd.2025.104027,Association between animal protein intake and overweight/obesity: A systematic review and meta-analysis of observational studies,Bricarello L.P.,2025,Nutrition Metabolism and Cardiovascular Diseases,0,,Broad: AHRQ mentions,TITLE-ABS-KEY(AHRQ),6.0,False,251,2-s2.0-105002224863,10.1016/j.numecd.2025.104027,Association between animal protein intake and overweight/obesity: A systematic review and meta-analysis of observational studies,Bricarello L.P.,2025,no_match,0.0,,,,,
2-s2.0-105001695591,10.1007/s11606-024-09221-8,Development of a Tool to Measure Potentially Inappropriate Inter-Hospital Transfer (IHT): The POINT Study,Mueller S.K.,2025,Journal of General Internal Medicine,0,,Broad: AHRQ mentions,TITLE-ABS-KEY(AHRQ),6.0,False,252,2-s2.0-105001695591,10.1007/s11606-024-09221-8,Development of a Tool to Measure Potentially Inappropriate Inter-Hospital Transfer (IHT): The POINT Study,Mueller S.K.,2025,no_match,0.0,,,,,
2-s2.0-105007069619,10.1371/journal.pone.0320603,Association between arsenic exposure and intrauterine growth restriction: A systematic review and meta-analysis,Jiang J.,2025,Plos One,0,,Broad: AHRQ mentions,TITLE-ABS-KEY(AHRQ),6.0,False,253,2-s2.0-105007069619,10.1371/journal.pone.0320603,Association between arsenic exposure and intrauterine growth restriction: A systematic review and meta-analysis,Jiang J.,2025,no_match,0.0,,,,,
2-s2.0-105004183991,10.1016/j.eclinm.2025.103194,Determinants of SARS-CoV-2 outcomes in patients with cancer vs controls without cancer: a multivariable meta-analysis with genomic imputation,Cheng M.T.K.,2025,Eclinicalmedicine,0,,Broad: AHRQ mentions,TITLE-ABS-KEY(AHRQ),6.0,False,254,2-s2.0-105004183991,10.1016/j.eclinm.2025.103194,Determinants of SARS-CoV-2 outcomes in patients with cancer vs controls without cancer: a multivariable meta-analysis with genomic imputation,Cheng M.T.K.,2025,no_match,0.0,,,,,
2-s2.0-85216300116,10.2106/JBJS.22.01273,Common Comorbidities and a Comparison of 4 Comorbidity Indices in Patients Undergoing Orthopaedic Oncology Surgery,Patel S.S.,2025,Journal of Bone and Joint Surgery,0,,Broad: AHRQ mentions,TITLE-ABS-KEY(AHRQ),6.0,False,255,2-s2.0-85216300116,10.2106/JBJS.22.01273,Common Comorbidities and a Comparison of 4 Comorbidity Indices in Patients Undergoing Orthopaedic Oncology Surgery,Patel S.S.,2025,no_match,0.0,,,,,
2-s2.0-85219713720,10.18240/ijo.2025.03.20,Effect of pharmacological pupil changes on intraocular lens power calculation: a systematic review and Meta-analysis,Tan S.Y.,2025,International Journal of Ophthalmology,0,,Broad: AHRQ mentions,TITLE-ABS-KEY(AHRQ),6.0,False,256,2-s2.0-85219713720,10.18240/ijo.2025.03.20,Effect of pharmacological pupil changes on intraocular lens power calculation: a systematic review and Meta-analysis,Tan S.Y.,2025,no_match,0.0,,,,,
2-s2.0-85214557401,10.1016/j.autrev.2025.103742,Systemic lupus erythematosus and male reproductive health: A systematic review and meta-analysis,Zhu J.,2025,Autoimmunity Reviews,1,,Broad: AHRQ mentions,TITLE-ABS-KEY(AHRQ),6.0,False,257,2-s2.0-85214557401,10.1016/j.autrev.2025.103742,Systemic lupus erythematosus and male reproductive health: A systematic review and meta-analysis,Zhu J.,2025,no_match,0.0,,,,,
2-s2.0-85203975469,10.1007/s12094-024-03706-y,The prevalence of oral mucositis after radiotherapy in patients with Head and Neck Cancer and its associated factors: a meta-analysis,Li E.,2025,Clinical and Translational Oncology,2,,Broad: AHRQ mentions,TITLE-ABS-KEY(AHRQ),6.0,False,258,2-s2.0-85203975469,10.1007/s12094-024-03706-y,The prevalence of oral mucositis after radiotherapy in patients with Head and Neck Cancer and its associated factors: a meta-analysis,Li E.,2025,no_match,0.0,,,,,
2-s2.0-105003215189,10.36849/JDD.8410R1,The Utility of Oral Polypodium Leucotomos Extract for Dermatologic Diseases:A Systematic Review,Zundell M.P.,2025,Journal of Drugs in Dermatology,0,,Broad: AHRQ mentions,TITLE-ABS-KEY(AHRQ),6.0,False,259,2-s2.0-105003215189,10.36849/JDD.8410R1,The Utility of Oral Polypodium Leucotomos Extract for Dermatologic Diseases:A Systematic Review,Zundell M.P.,2025,no_match,0.0,,,,,
2-s2.0-85217203029,10.12114/j.issn.1007-9572.2024.0449,The Prevalence of Osteosarcopenia in Chinese Patients with Type 2 Diabetes Mellitus：a Meta-analysis,Sun Q.,2025,Chinese General Practice,0,,Broad: AHRQ mentions,TITLE-ABS-KEY(AHRQ),6.0,False,260,2-s2.0-85217203029,10.12114/j.issn.1007-9572.2024.0449,The Prevalence of Osteosarcopenia in Chinese Patients with Type 2 Diabetes Mellitus：a Meta-analysis,Sun Q.,2025,no_match,0.0,,,,,
2-s2.0-105003541355,10.3760/cma.j.cn311847-20240619-00143,Meta-analysis of common diseases among military personnel in the tropical environment of Chinese islands,Shu J.,2025,Chinese Journal of Nautical Medicine and Hyperbaric Medicine,0,,Broad: AHRQ mentions,TITLE-ABS-KEY(AHRQ),6.0,False,261,2-s2.0-105003541355,10.3760/cma.j.cn311847-20240619-00143,Meta-analysis of common diseases among military personnel in the tropical environment of Chinese islands,Shu J.,2025,no_match,0.0,,,,,
2-s2.0-105000358861,10.1016/j.jtv.2025.100881,Incidence of pressure injuries in patients with spinal cord injury: A systematic review and meta-analysis,Xu J.,2025,Journal of Tissue Viability,0,,Broad: AHRQ mentions,TITLE-ABS-KEY(AHRQ),6.0,False,262,2-s2.0-105000358861,10.1016/j.jtv.2025.100881,Incidence of pressure injuries in patients with spinal cord injury: A systematic review and meta-analysis,Xu J.,2025,no_match,0.0,,,,,
2-s2.0-105001800849,10.1016/j.jhqr.2025.01.001,Analysis of patient safety indicators in complications due to care during hospitalization,Escandell Rico F.M.,2025,Journal of Healthcare Quality Research,0,,Broad: AHRQ mentions,TITLE-ABS-KEY(AHRQ),6.0,False,263,2-s2.0-105001800849,10.1016/j.jhqr.2025.01.001,Analysis of patient safety indicators in complications due to care during hospitalization,Escandell Rico F.M.,2025,no_match,0.0,,,,,
2-s2.0-85214788702,10.1111/phn.13524,Prevalence and Risk Factors of Cognitive Impairment in COPD: A Systematic Review and Meta-Analysis,Zhang Z.,2025,Public Health Nursing,1,,Broad: AHRQ mentions,TITLE-ABS-KEY(AHRQ),6.0,False,264,2-s2.0-85214788702,10.1111/phn.13524,Prevalence and Risk Factors of Cognitive Impairment in COPD: A Systematic Review and Meta-Analysis,Zhang Z.,2025,no_match,0.0,,,,,
2-s2.0-105002410236,10.1016/j.gerinurse.2025.03.060,"Visit rates and risk factors of healthcare-seeking behavior for urinary incontinence, fecal incontinence, and pelvic organ prolapse among women: A systematic review and meta-analysis",Hou J.,2025,Geriatric Nursing,0,,Broad: AHRQ mentions,TITLE-ABS-KEY(AHRQ),6.0,False,265,2-s2.0-105002410236,10.1016/j.gerinurse.2025.03.060,"Visit rates and risk factors of healthcare-seeking behavior for urinary incontinence, fecal incontinence, and pelvic organ prolapse among women: A systematic review and meta-analysis",Hou J.,2025,no_match,0.0,,,,,
2-s2.0-105002882999,10.1016/j.gerinurse.2025.03.048,Association of dietary pattern and cognitive function in the elderly: A systematic review and meta-analysis,Pei H.,2025,Geriatric Nursing,0,,Broad: AHRQ mentions,TITLE-ABS-KEY(AHRQ),6.0,False,266,2-s2.0-105002882999,10.1016/j.gerinurse.2025.03.048,Association of dietary pattern and cognitive function in the elderly: A systematic review and meta-analysis,Pei H.,2025,no_match,0.0,,,,,
2-s2.0-105001099080,10.1016/j.socscimed.2025.118025,Detection of potential causal pathways among social determinants of health: A data-informed framework,Korvink M.,2025,Social Science and Medicine,0,,Broad: AHRQ mentions,TITLE-ABS-KEY(AHRQ),6.0,False,267,2-s2.0-105001099080,10.1016/j.socscimed.2025.118025,Detection of potential causal pathways among social determinants of health: A data-informed framework,Korvink M.,2025,no_match,0.0,,,,,
2-s2.0-105005515450,10.7326/ANNALS-24-02446,Health Care Delivery of Clinical Preventive Services for People With Disabilities A Systematic Review,Buckley D.I.,2025,Annals of Internal Medicine,1,,Broad: AHRQ mentions,TITLE-ABS-KEY(AHRQ),6.0,False,268,2-s2.0-105005515450,10.7326/ANNALS-24-02446,Health Care Delivery of Clinical Preventive Services for People With Disabilities A Systematic Review,Buckley D.I.,2025,no_match,0.0,,,,,
2-s2.0-85219029005,10.1016/j.archger.2025.105782,Frailty and pre-frailty prevalence in community-dwelling elderly with multimorbidity: A systematic review and meta-analysis,Cai S.,2025,Archives of Gerontology and Geriatrics,1,,Broad: AHRQ mentions,TITLE-ABS-KEY(AHRQ),6.0,False,269,2-s2.0-85219029005,10.1016/j.archger.2025.105782,Frailty and pre-frailty prevalence in community-dwelling elderly with multimorbidity: A systematic review and meta-analysis,Cai S.,2025,no_match,0.0,,,,,
2-s2.0-85219018030,10.1016/j.jcjq.2025.01.007,Patient Safety Culture Among Nurses in Hospital Settings Worldwide: A Systematic Review and Meta-Analysis,Kyriakeli G.,2025,Joint Commission Journal on Quality and Patient Safety,1,,Broad: AHRQ mentions,TITLE-ABS-KEY(AHRQ),6.0,False,270,2-s2.0-85219018030,10.1016/j.jcjq.2025.01.007,Patient Safety Culture Among Nurses in Hospital Settings Worldwide: A Systematic Review and Meta-Analysis,Kyriakeli G.,2025,no_match,0.0,,,,,
2-s2.0-85170365391,10.1007/s40615-023-01794-0,"The Incidence, Prevalence and Mortality Rates of Black and White Persons with HIV in the United States in 2019",Hellinger F.J.,2024,Journal of Racial and Ethnic Health Disparities,1,,Broad: AHRQ mentions,TITLE-ABS-KEY(AHRQ),6.0,False,271,2-s2.0-85170365391,10.1007/s40615-023-01794-0,"The Incidence, Prevalence and Mortality Rates of Black and White Persons with HIV in the United States in 2019",Hellinger F.J.,2024,no_match,0.0,,,,,
2-s2.0-85210498393,10.1186/s12877-024-05507-y,Association of motoric cognitive risk syndrome with depression in older adults: a meta-analysis and systematic review of cross-sectional and cohort studies,Zhou S.,2024,BMC Geriatrics,1,,Broad: AHRQ mentions,TITLE-ABS-KEY(AHRQ),6.0,False,272,2-s2.0-85210498393,10.1186/s12877-024-05507-y,Association of motoric cognitive risk syndrome with depression in older adults: a meta-analysis and systematic review of cross-sectional and cohort studies,Zhou S.,2024,no_match,0.0,,,,,
2-s2.0-85211188970,10.1186/s12916-024-03799-w,Ethics practices associated with reusing health data: an assessment of patient registries,van den Akker O.R.,2024,BMC Medicine,0,,Broad: AHRQ mentions,TITLE-ABS-KEY(AHRQ),6.0,False,273,2-s2.0-85211188970,10.1186/s12916-024-03799-w,Ethics practices associated with reusing health data: an assessment of patient registries,van den Akker O.R.,2024,no_match,0.0,,,,,
2-s2.0-85191541496,10.14423/SMJ.0000000000001686,Opioid Use Disorder among Hospitalized Adults in North Carolina: Analysis from the 2000-2020 NC State Inpatient Database,Alemu B.T.,2024,Southern Medical Journal,0,,Broad: AHRQ mentions,TITLE-ABS-KEY(AHRQ),6.0,False,274,2-s2.0-85191541496,10.14423/SMJ.0000000000001686,Opioid Use Disorder among Hospitalized Adults in North Carolina: Analysis from the 2000-2020 NC State Inpatient Database,Alemu B.T.,2024,no_match,0.0,,,,,
2-s2.0-85198490240,10.5644/ama2006-124.443,An Efficacy and Safety Comparison of Regorafenib and Nivolumab in Unresectable Hepatocellular Cancer Patients: A Systematic Review,Darmadi D.,2024,Acta Medica Academica,0,,Broad: AHRQ mentions,TITLE-ABS-KEY(AHRQ),6.0,False,275,2-s2.0-85198490240,10.5644/ama2006-124.443,An Efficacy and Safety Comparison of Regorafenib and Nivolumab in Unresectable Hepatocellular Cancer Patients: A Systematic Review,Darmadi D.,2024,no_match,0.0,,,,,
2-s2.0-85144383350,10.1177/19322968221142899,A Machine Learning Model for Prediction of Amputation in Diabetics,Stefanopoulos S.,2024,Journal of Diabetes Science and Technology,7,,Broad: AHRQ mentions,TITLE-ABS-KEY(AHRQ),6.0,False,276,2-s2.0-85144383350,10.1177/19322968221142899,A Machine Learning Model for Prediction of Amputation in Diabetics,Stefanopoulos S.,2024,no_match,0.0,,,,,
2-s2.0-85199811549,10.1002/jeo2.12101,No difference in postoperative patient satisfaction rates between mechanical and kinematic alignment total knee arthroplasty: A systematic review,Khan Z.A.,2024,Journal of Experimental Orthopaedics,1,,Broad: AHRQ mentions,TITLE-ABS-KEY(AHRQ),6.0,False,277,2-s2.0-85199811549,10.1002/jeo2.12101,No difference in postoperative patient satisfaction rates between mechanical and kinematic alignment total knee arthroplasty: A systematic review,Khan Z.A.,2024,no_match,0.0,,,,,
2-s2.0-85196430841,10.1016/j.nepr.2024.104024,"Evidence-based practice attitudes, knowledge and skills of nursing students and nurses, a systematic review and meta-analysis",Li H.,2024,Nurse Education in Practice,6,,Broad: AHRQ mentions,TITLE-ABS-KEY(AHRQ),6.0,False,278,2-s2.0-85196430841,10.1016/j.nepr.2024.104024,"Evidence-based practice attitudes, knowledge and skills of nursing students and nurses, a systematic review and meta-analysis",Li H.,2024,no_match,0.0,,,,,
2-s2.0-85196614057,10.3761/j.issn.0254-1769.2024.12.007,Summary of the best evidence on health education for patients with temporary enterostomies,Li D.,2024,Chinese Journal of Nursing,1,,Broad: AHRQ mentions,TITLE-ABS-KEY(AHRQ),6.0,False,279,2-s2.0-85196614057,10.3761/j.issn.0254-1769.2024.12.007,Summary of the best evidence on health education for patients with temporary enterostomies,Li D.,2024,no_match,0.0,,,,,
2-s2.0-85201706360,10.1086/731508,"ERRATUM: Heterogeneous Effects of the Affordable Care Act on Emergency Department Visits and Payer Composition among Older Adults by Race and Ethnicity (American Journal of Health Economics (2024), 10, 2, (272–299), 10.1086/728787)",,2024,American Journal of Health Economics,0,,Broad: AHRQ mentions,TITLE-ABS-KEY(AHRQ),6.0,False,280,2-s2.0-85201706360,10.1086/731508,"ERRATUM: Heterogeneous Effects of the Affordable Care Act on Emergency Department Visits and Payer Composition among Older Adults by Race and Ethnicity (American Journal of Health Economics (2024), 10, 2, (272–299), 10.1086/728787)",,2024,no_match,0.0,,,,,
